sno,hid,hname,state,city,address,zipcode,statecode
0665,HMP0665,Aditya Nursing Home,Madhya Pradesh,Indore,"#315, Usha Nagar Extension.",452009,MP
0666,HMP0666,Agrawal Hospital,Madhya Pradesh,Bhopal,"E-3/15, Opp Habibganj Railway Stn, Arera Colony, Bopal,Mp-462016",462016,MP
0667,HMP0667,Ajwani Eye Hospital Pvt. Ltd.,Madhya Pradesh,Bhopal,"# 115, Berasia Road, Bh0Pal Sindhi Colony, Bhopal-462018",462018,MP
0668,HMP0668,Akshaya Heart Hospital,Madhya Pradesh,Bhopal,"Rishi Nagar, Char Imli, Opp Ekant Park.Bhopal, Madhya Pradesh",462016,MP
0669,HMP0669,Anand Hospital & Research Centre Pvt Ltd,Madhya Pradesh,Indore,"7, Sindhu Nagar, Bhanwarkua Main Road",452001,MP
0670,HMP0670,Anant Nursing Home Pvt Ltd,Madhya Pradesh,Jabalpur,"Madan Mahal Station Road,Gate #3,Wright Town",482001,MP
0671,HMP0671,Anant Shree Hospital,Madhya Pradesh,Bhopal,"Indrapuri A- Sector, Opp. Bhel Gate # 1,Indrapuri",462021,MP
0672,HMP0672,Apex Hospital,Madhya Pradesh,Gwalior,"#34,Tagore Nagar,Gwalior",474011,MP
0673,HMP0673,Apex Research Centre & Hospital Pvt Ltd,Madhya Pradesh,Bhopal,"116-117, Sindhi Colony, Berasia Road,",462001,MP
0674,HMP0674,Appollo Medical Invstgations & Appollo Nursing Home,Madhya Pradesh,Indore,"# 584, M.G. Road, New Palasiaindore",452001,MP
0675,HMP0675,Arihant Hospital & Research Centre,Madhya Pradesh,Indore,"283-A, Gumasta Nagar",452009,MP
0676,HMP0676,Arpan Hospital And Research Center,Madhya Pradesh,Indore,"15/2, Imli Bazar Near Rajnadaindore ( M.P )",452004,MP
0677,HMP0677,Ashirwad Nursing Home,Madhya Pradesh,Ratlam,"55-56,Ved Vyas Colony",457001,MP
0678,HMP0678,Ashish Hospital,Madhya Pradesh,Jabalpur,"#1309, Napier Town,Home Science College Road.",482001,MP
0679,HMP0679,Asian Globus Liver & Gastroenterology Centre,Madhya Pradesh,Bhopal,"E-5/24,Arera Colony, Arera Petrol Pump, Bhopal",462016,MP
0680,HMP0680,Ayushman Hospital,Madhya Pradesh,Bhopal,"C-Sector, Shahpura Lake",462014,MP
0681,HMP0681,Ayushman Neuro Cardio Centre Shubham Hospital,Madhya Pradesh,Gwalior,"14-B,Vijaynagar Extension,Near Prem Motors,Baant Vihar",474002,MP
0682,HMP0682,Bafna Hospital & Orthopaedic Research Centre,Madhya Pradesh,Indore,"18/1, North Rajmohalla",452002,MP
0683,HMP0683,Bapat Hospital,Madhya Pradesh,Indore,"Ahd-30, Sukhlia",452010,MP
0684,HMP0684,Batalia Eye Hosptial,Madhya Pradesh,Jabalpur,"Dr. Batalia Road, Near Clock Tower",482001,MP
0685,HMP0685,Batra Hospital,Madhya Pradesh,Bhopal,"#17, Zone-1, Mp Nagar",462011,MP
0686,HMP0686,Bhagyoday Tirth Hospital,Madhya Pradesh,Sagar,Khurai Road,470002,MP
0687,HMP0687,Bhandari Hospital & Research Centre,Madhya Pradesh,Indore,"Gf-21,22,23 Scheme # 54, Vijay Nagar",452014,MP
0688,HMP0688,Bhandari Polyclinic Pvt Ltd,Madhya Pradesh,Jabalpur,"#659, Napier Town,",482001,MP
0689,HMP0689,Bharat Hospital And Research Centre,Madhya Pradesh,Jabalpur,"Patrakar Colony, Near Ranital Chowk",482002,MP
0690,HMP0690,Bhopal Charitable Hospital,Madhya Pradesh,Bhopal,"Noor Mahal Road,Chowki Imambadachowki Imambaba, Bhopal-462001",462001,MP
0691,HMP0691,Bhopal Eye Hospital,Madhya Pradesh,Bhopal,"# 29, Rajdev Colony, Barasia Road",462001,MP
0692,HMP0692,Bhopal Heart & General Hospital,Madhya Pradesh,Bhopal,"H3 B Sector, Sonagiri",462021,MP
0693,HMP0693,Bombay Hospital,Madhya Pradesh,Indore,"Ida - Scheme ,No .94/95Ring Road ,",452010,MP
0694,HMP0694,Bombay Hospital & Research Centre Jabalpur,Madhya Pradesh,Jabalpur,"906-Gol Bazar, Jabalpur, Madhya Pradesh, Shaheed Smarak Ground.",482002,MP
0695,HMP0695,Career Institute Of Medical Sciences(Cims),Madhya Pradesh,Bhopal,"Career College Campus,Govindpura, Bhelgovindpura, Bhel, Bhopal.",462023,MP
0696,HMP0696,Centre For Sight-Indore,Madhya Pradesh,Scheme,"Plot No. 124, Sector-Ab, Scheme:-54, Indore, Madhya Pradesh",452010,MP
0697,HMP0697,Charak Hospital & Research Centre,Madhya Pradesh,Bhopal,"Old Navbharat Press Building, Jehengirabad.",462008,MP
0698,HMP0698,Charak Hospital Pvt Ltd,Madhya Pradesh,Indore,"Ranisati Gate, Yeshwant Niwas Road.Y.N.Road,",452003,MP
0699,HMP0699,Chirayu Health & Medicare (P) Ltd,Madhya Pradesh,Bhopal,"#6, Malipurle,Behind Sadar Marzil",462001,MP
0700,HMP0700,Citi Hospital,Madhya Pradesh,Bhopal,"#115-Zone Ii,Maharana Pratap Nagar,",462011,MP
0701,HMP0701,City Hospital & Research Centre,Madhya Pradesh,Gwalior,"Jail Road, Bohadapur, Gwalior, Madhya Pradesh.",474012,MP
0702,HMP0702,Convenient Hospital Ltd,Madhya Pradesh,Indore,"Ab Road, Near Lig Tringnee, Indorenear L.I.G. Square,",452001,MP
0703,HMP0703,Curewell Hospital Pvt. Ltd.,Madhya Pradesh,Indore,"19/1-C,New Palasia, Indore",452001,MP
0704,HMP0704,Deep Hospital,Madhya Pradesh,Bhopal,"Hig-33, Shivajinagar",462016,MP
0705,HMP0705,Dewas Hospital And Research Centre,Madhya Pradesh,Dewas,"231,A.B. Road,Dewas",455001,MP
0706,HMH0706,A-Care Orthopaedic & General Hospital,Maharashtra,Mumbai,"G-1, Giriraj Tower, Sai Baba Nagar, Mira Bhayander Road, Mira Road.",401107,MH
0707,HMH0707,A.U.S. Clinic & Lithotripsy Centre,Maharashtra,Mumbai,"Arun Chambers, Tardeo, Mumbai-400034Tardeo",400034,MH
0708,HMH0708,Aabu Tayshete Memorial Hospital,Maharashtra,Sindhudurga,"Behind Hotel Sahyadri Kankavlisindhudurga, Maharashtra.",416602,MH
0709,HMH0709,Aaditya Hospital,Maharashtra,Sangli,Main Chowk Vishrambag,416415,MH
0710,HMH0710,Aakashdeep Hospital,Maharashtra,Koparkhairane,"# 98, Sector-7, Koperkhairna,Navi Mumbai-400709.",400709,MH
0711,HMH0711,Aarogyam Multispeciality Hospital,Maharashtra,Mumbai,"1St Floor, Renuka Bldg, Appo Mangala High School, Above Bank, Maharashtra, Mumbaimumbai",400603,MH
0712,HMH0712,Aashirwad Hospital,Maharashtra,Thane,"Om Shraddha Tower, Above Tdcc Bank Pune Link Road, Tisgaon, Kalyan Est, Thane.",421306,MH
0713,HMH0713,Aashirwad Nursing Home,Maharashtra,Mumbai,"Ashirwad, Swami Samarth Nagar, 2Nd Cross Lane, Lokhandwala Complex, Andheri West",400053,MH
0714,HMH0714,Aashirwad Nursing Home & Iccu,Maharashtra,Mumbai,"A3, New Green Apartments,Tilak Chowk, Turel Pakhadi Roa",400064,MH
0715,HMH0715,Aastha Hospital,Maharashtra,Thane,"No.104,New Krishna Housing Society,Near Dhuri Motors,Ambadi Road,Vasai(W),Thane,",401202,MH
0716,HMH0716,Aastha Hospital,Maharashtra,Ulhasnagar,Hospital Area Ulhasnagar -3Thane,421003,MH
0717,HMH0717,Aayush Eye Clinic,Maharashtra,Mumbai,"201, Coral Classic,20Th Road.",400071,MH
0718,HMH0718,Abhijit Hospital,Maharashtra,Mumbai,Divya Trusha Mamlatdar Wadiroad Malad (West),400064,MH
0719,HMH0719,Abhinav Multispeciality Hospital,Maharashtra,Nagpur,"Naya Nakasha, Lashkari Bagh.",440017,MH
0720,HMH0720,Abhishek Nursing Home (L.P.Diagnostics Pvt. Ltd.),Maharashtra,Mumbai,"Jagruti Co-Op.Soci Bhatwadi,Ghatkopm- (W), Mumbai - 400084Near Maratha Mandir,Co-Op Bank",400084,MH
0721,HMH0721,Acharya Vinoba Bhave Rural Hospital,Maharashtra,Wardha,"Yavatmal Road,Sawangi (Meghe)Wardha-442004.",442004,MH
0722,HMH0722,Adarsh Hospital,Maharashtra,Mumbai,"Meenakshi Apartments,C - Wing, 1St Floor, Marve Road,Maladmalad (W)",400064,MH
0723,HMH0723,Adarsh Hospital,Maharashtra,Pune,"Sn 11/12,Kondhwa Budruk,Near Katraj Khondwa Road,Near Kaveri Apartments",411048,MH
0724,HMH0724,Adittya Eye Clinic,Maharashtra,Mumbai,"M.G.Road, Ronik Apts, 1St Floor,Kandival(W)",400067,MH
0725,HMH0725,Aditya Eye Clinic And Contact Lens Centre,Maharashtra,Pune,"Office # 1A,Kumar Plaza,M.G.Road,",411001,MH
0726,HMH0726,Aditya Jyot Eye Hospital (P) Ltd.,Maharashtra,Mumbai,"Plot # 153,Mojar Parmeshwaranroad (Opp) Siws Collage Gate #",400031,MH
0727,HMH0727,Agarwal Maternity & General Hospital,Maharashtra,Pune,"S/N.45/1,2 & 5,Sangarsh Chowk,Kharadi Road,Chandannagar,",411014,MH
0728,HMH0728,Agarwal Nursing Home,Maharashtra,Mumbai,"4Th Floor,Shanti Centre, Plot # 8,Sec-17,Vashi,Navi Mumbai,Vashi, Navi Mumbai-400703",400703,MH
0729,HMH0729,Aggarwal Eye Hospital,Maharashtra,Mumbai,"No.102/5,Ketayan Mansion,Shahaji Raje Marg,Koldongri,Andheri(E),Sahaje Raje Marg, Koldongri,",400069,MH
0730,HMH0730,Agrawal Clinic Surgical & General Hospital With Icu,Maharashtra,Mumbai,"49, Daftary Road, Malad (East), Mumbai, Maharashtra, Opp. Subhash Lane.",400097,MH
0731,HMH0731,Agrawal Eye Hospital,Maharashtra,Mumbai,"1St Floor, Maharaja Apartment, Opp. Tel. Exchange, S.V. Road, Malad (West) Mumbai-400064",400064,MH
0732,HMH0732,Agrawal Nursing Home,Maharashtra,Mumbai,"Bombay Market, St.Road, Bhayander West,Bhayander, Thane",401104,MH
0733,HMH0733,Ahirkar Hospital,Maharashtra,Bhiwandi,"Near Ratan Cinema Narpoli,Bhiwandi,Thane",421302,MH
0734,HMH0734,Ahuja Nursing Home & Polyclinic,Maharashtra,Ulhasnagar,"Furniture Bazar,Ulhas Nagar,Dass Chambers,1St Floor",421002,MH
0735,HMH0735,Akanksha Maternity & Surgical Hospital,Maharashtra,Mumbai,"6, Manish Tower, Manish Nagar, J P Road, Ahdheri(W)J.P. Road, Andheri (W)",400053,MH
0736,HMH0736,Akshay Eye Clinic,Maharashtra,Raigad,"#842,Mahatma Gandhi Road,Panvel",410206,MH
0737,HMH0737,Akshay Medical Foundation,Maharashtra,Pune,"204/G Ward,Mg Roadlonawala",410401,MH
0738,HMH0738,Akshayjyot Eye Hospial,Maharashtra,Buldana,"Yashowardhan,Mutthe Layout.",443001,MH
0739,HMH0739,Alatkar Hospital,Maharashtra,Pune,"Bhosale Garden,Opp 111 Bus Stop,Pune Solapur Road",411028,MH
0740,HMH0740,Alhat Nursing Home,Maharashtra,Pune,"Hira-Ratan Plaza,Pune Nashik Highway Pmt Chowk,Bhosari",411039,MH
0741,HMH0741,Amardeep Nursing Home,Maharashtra,Thane,"101 Ratna Tarang, Old Nagardas Road, Andheri (E)Old Nagardas Road,Andheri (E)",400069,MH
0742,HMH0742,Ambika Hospital,Maharashtra,Solapur,"Murarji Peth, Solapur-413002.",413002,MH
0743,HMH0743,Amrut Hospital & Endoscopy Clinic,Maharashtra,Mumbai,"Dr. Rajendra Prasad Road, Tilak Nagar, Dombivali(E), Thane, Maharashtra",421201,MH
0744,HMH0744,Anamaya Nursing Home,Maharashtra,Pune,"Sn48/1B/5-Gokulnagar,Katraj Kondhwa Road,Kondhawa Budruk",411048,MH
0745,HMH0745,Anand Hospital,Maharashtra,Jamkhed,"Nagar Road, Near S.T Stand,Ahemdnagar",413201,MH
0746,HMH0746,Anand Hospital,Maharashtra,Pune,"Shrikrishnapalace,Sn 136,Near Malwadi Police Station Warje,Malwadi",411058,MH
0747,HMH0747,Anand Hospital,Maharashtra,Pune,"Balaji Tower,Mahatma Phule Chowke,Chakan",410501,MH
0748,HMH0748,Anand Hospital,Maharashtra,Pune,"Sector-26,Plot 113, Hutatma Chowk Pradhikaran, Nigdi Pune-411044",411044,MH
0749,HMH0749,Anand Maternity & Nursing Home,Maharashtra,Mumbai,"Saregram Complex, New Link Rd,Dahison (E), Mumbai-400068.",400068,MH
0750,HMH0750,Anand Medical Foundation Subudh Hospital,Maharashtra,Pune,"145,Kothrod Near Shivaji Statue",411038,MH
0751,HMH0751,Anand Nursing Home,Maharashtra,Kolhapur,"#1758 B/1, Sakoli Corner, K Ward.",416012,MH
0752,HMH0752,Anand Nursing Home,Maharashtra,Mumbai,"Divya Sarjan, 1St Floor, 90 Ft Road, Ganesh Chowk,Charkop,Kandivali West",400067,MH
0753,HMH0753,Anande Hospital,Maharashtra,Pune,"Near Old R T O Office,Ramnagar, Chandrapur,Near Old R.T.O. Office.",442402,MH
0754,HMH0754,Anandpara Surgical & General Hospital,Maharashtra,Mumbai,"Iqbal House, Rani Sati Marg Off.Pandit Socicitor Lane, Malad (East)Malad (E), Mumbai - 97",400097,MH
0755,HMH0755,Anandrishiji Hospital & Medical Research Centre,Maharashtra,Ahmednagar,"124, Anand Rishiji Marg",414001,MH
0756,HMH0756,Anil Eye Hospital,Maharashtra,Mumbai,"1St Floor, Krishna Smirti, Phadke Road, Dombivli",421201,MH
0757,HMH0757,Anjali Hospital,Maharashtra,Pune,#568-Dr.Ambedkar Chowk Opp Delux Cinema Pimpri,411017,MH
0758,HMH0758,Ankur Hospital,Maharashtra,Mumbai,"1St Floor, Kalpatoru,Mathura Das Road,Kandivli (W)Mathuradas Rd, Kandivli (W)",400067,MH
0759,HMH0759,Ankur Maternity And Surgical Nursing Home,Maharashtra,Mumbai,"Shree Vijay Chs Ltd,Kanjur Marg East",400042,MH
0760,HMH0760,Ankur Nursing Home,Maharashtra,Thane,"Mohan Plaza, Main Road, Opposite Section, Ulhasnagar, Thane-421501",421501,MH
0761,HMH0761,Ankur Nursing Home & Pain Clinic,Maharashtra,Pune,"Ashirwad Complex Chindhwad Main Road, Bus Stop Kalewadi Road,Chinchwad",411033,MH
0762,HMH0762,Anmmol Orthovision,Maharashtra,Mumbai,"101-102,Manisha Heights,Balrajeshwar Road,Mulund West",400080,MH
0763,HMH0763,Annapurna Hospital,Maharashtra,Kheda,"Mina Bazar,Kapadvanj City,",387620,MH
0764,HMH0764,Anuchandra Accident Hospital,Maharashtra,Baramati,"Geetai Building, Cinema Road,",413102,MH
0765,HMH0765,Anupama Maternity & Nursing Home,Maharashtra,Mumbai,"1/18, Jaykar Smruti,Aarey Road, Goregaon West.",400062,MH
0766,HMH0766,Apex Hospital,Maharashtra,Mumbai,"A-Wing, Vaishali Heights, Chandavarkar Road, Borivali (W), Mumbai-400092",400092,MH
0767,HMH0767,Apex Hospital,Maharashtra,Mumbai,"Gupte Road, Opp.Shivsena Shakha",421202,MH
0768,HMH0768,Apex Hospital,Maharashtra,Mumbai,"Parnaka, Shivtirth, Apt. Ground Floor, Kalyan, Thane, Maharashtra.",421301,MH
0769,HMH0769,Apex Kidney Care Pvt Ltd,Maharashtra,Mira Road,"101, Eden Rose Shopping Complex,Opp. Cinemax Multiplex,Beverly Park, Mira Road (E),Thane",401107,MH
0770,HMH0770,Apex Kidney Care Pvt Ltd,Maharashtra,Mumbai,"''Gaurav Plaza, Annex, R.R.T. Road, Mulund (W), Mumbai",400080,MH
0771,HMH0771,Apex Kidney Care Pvt Ltd,Maharashtra,Mumbai,"C/O. Sushrut Hospital, 2Nd Fllor, Swastik Park, Near Kach Gujar Hall, Chembur (E). Mumbai",400071,MH
0772,HMH0772,Apex Kidney Care Pvt Ltd,Maharashtra,Mumbai,"Abhishek Commericial Complex, 3Rd Floor S.V. Road, Malad, Near Aditi Hotel, Mumbai, Maharashtra.",400064,MH
0773,HMH0773,Apulki Vairagade Multispeciality Hospital,Maharashtra,Nagpur,"Manewada Cement Road,Plot # 151,Opp To Navdurga Mandir",440024,MH
0774,HMH0774,Argade Hospital & Maternity Home,Maharashtra,Pune,"Pune-Nashik Highway,Ambethan Chawk,Chakan Talkhed",410501,MH
0775,HMH0775,Arihant Heart Clinic,Maharashtra,Mumbai,"103, Lancelot, Next To Dattani Nagar, S V Road Borivali(West)S.V.Road, Borivili (W),",400092,MH
0776,HMH0776,Arneja Institute Of Cardialogy Pvt Ltd,Maharashtra,Nagpur,"123, Ramdaspeth Behind Somalwar School",440010,MH
0777,HMH0777,Arogyam Superspeciality Hospital,Maharashtra,Nagpur,"#34, Sita Nagar Wardha Road Opp Green Wally Lawns",440025,MH
0778,HMH0778,Arogyaseva Medical Academy Of India,Maharashtra,Pune,"32/2A,Erandwanabehind Mehendale Garage",411004,MH
0779,HMH0779,Arpan General Hospital,Maharashtra,Mumbai,"Arpan Shopping Arcade, 1St Floor, C.S.T. Road, Kurla West.",400070,MH
0780,HMH0780,Asha Hospital,Maharashtra,Mumbai,"# 1, Akurli Cross Road, Kandivli East,Premaskram Manidr Lane,",400101,MH
0781,HMH0781,Asha Hospital,Maharashtra,Nagpur,"#7,Near Lekhanagar,Cantonment,Kamptee",441001,MH
0782,HMH0782,Asha Hospital& Iccu,Maharashtra,Mumbai,"Plot # 134,Sect 4, Aniatic Society, Airoli,Navi Mumbai-400708",400708,MH
0783,HMH0783,Asha Maternity & Childrens Hospital,Maharashtra,Jalgaon,"Ganesh Raod, Chalishoon Dist,",424101,MH
0784,HMH0784,Asha Maternity & General Hospital,Maharashtra,Mumbai,"Pooja Building, Pushpa Park, Daftary Road, Malad East.",400097,MH
0785,HMH0785,Asha Orthopaedic Hospital,Maharashtra,Mumbai,"Bashi Kalingar,#2,Geetha Bhavan Lane Off,Navghar Road,Bhayander East,Thane",401105,MH
0786,HMH0786,Asha Polyclinic & Shetal Nursing Home,Maharashtra,Mumbai,"145, 60 Feet Road,Opp.Uti Bank,Ghatkopar(E)-400077Chatkopur (E), Mumbai - 400077",400077,MH
0787,HMH0787,Ashirwad Children & Surgical Hospital,Maharashtra,Mumbai,"No.301-306,Ruby Monarch Bldg,Sakivihar Road,Sakinaka,Opp.Post Office,",400072,MH
0788,HMH0788,Ashirwad Hospital,Maharashtra,Mumbai,"#117,Kaap Kaneri,Thane,Opp Gopal Nagar Near Kalyan Naka",421302,MH
0789,HMH0789,Ashirwad Hospital,Maharashtra,Mumbai,"Maratha Section,Near Jijamatha Udyan,Ulhasnagar,Thane",421004,MH
0790,HMH0790,Ashirwad Hospital,Maharashtra,Pune,"2Nd Floor,Punit Yash Arcade,Near Kothurd Bus Stand,Karve Road",411038,MH
0791,HMH0791,Ashirwad Hospital & Poly Clinic,Maharashtra,Mumbai,"#101, 103, Anurag Busines Centre, W.T.Patil Marg, Ghtla Villate, Chemburw.T. Patil Marg,Ghatla Village",400071,MH
0792,HMH0792,Ashirwad Maternity & General Hosptial,Maharashtra,Thane,"17,18 Samir Apt,Jesal Park,Bhayandar East,Thane",401105,MH
0793,HMH0793,Ashirwad Maternity & Nursing Home,Maharashtra,Mumbai,"A/5,Harsh Appartment,Anand Nagar,Dhisar East",400068,MH
0794,HMH0794,Ashirwad Nursing Home,Maharashtra,Nalasopara,"'C'Wing, Seema Complex, Tulinj Road,Nalasopara(E),Thane,",401205,MH
0795,HMH0795,Ashirwad Orthopaedic And Surgical Nursing Home,Maharashtra,Mumbai,"Jambli Galli, Opp. Jain Temple, Borivali(W)",400092,MH
0796,HMH0796,Ashtavinayak Maternity Eye & Sugical Nursing Home,Maharashtra,Mumbai,"Mtnl Marg College Lane, Ramgiri Heights, 104 First Floor.",400028,MH
0797,HMH0797,Ashtvinayak Hospital,Maharashtra,Raigad,"Khanda Colony,New Panvel West.",410206,MH
0798,HMH0798,Ashvini Maternity & Gynecological Hospital,Maharashtra,Raigad,"Plot #59/1,Old Thanaka Road,Panvel",410206,MH
0799,HMH0799,Ashwini Accident Multispeciality Hospital,Maharashtra,Nashik,"Govind Nagar,Chowk #5,Behind Hotel Prakash,",422001,MH
0800,HMH0800,Ashwini Hospital,Maharashtra,Pune,"Dattahasta 20/156,Bijali Nagar,Chinchwad",411033,MH
0801,HMH0801,Ashwini Kidney & Dialysis Centre,Maharashtra,Nagpur,"301 & Central Bazar Road, Ramdaspeth, Neet Gaurav Complex, Nagpur, Maharashtra",440010,MH
0802,HMH0802,Ashwini Maternity & Surgical Hospital,Maharashtra,Mumbai,"Ambika Darshan, M G Road, Above Bharti Jewellers, Rajawadi, Ghatkopar East, Mumbai - 400075 ,M.G.Road, Ghatkopar",400075,MH
0803,HMH0803,Ashwini Multispeciality Hospital,Maharashtra,Mumbai,"Vadvau Section, Ambernath,Thane",421501,MH
0804,HMH0804,Ashwini Nursing And Maternity Home,Maharashtra,Mumbai,"Mohan Niwas Keluskar Rdnear Meenatai Thakare Statue Shivaji Parkkeluskar Road, Dadar (W)",400028,MH
0805,HMH0805,Ashwini Nursing Home,Maharashtra,Pune,"S.No#51,Plot#16,Dhanori Road,Maharanapratap Chawk,Vishrantwadi",411015,MH
0806,HMH0806,Ashwini Sahakari Rugnalaya & Research Centre,Maharashtra,Sholapur,"North Sadar Bazar, Near Bhagatsingh Marketnear Bhagatsingh Market,",413003,MH
0807,HMH0807,Asian Eye Institute & Laser Centre,Maharashtra,Mumbai,"# 101A, Satya Narayan Apartment,Off M.G.Road, Borivali(E), Mumbai-400066",400066,MH
0808,HMH0808,Asian Institute Of Medical Science,Maharashtra,Thane,"Plot No.P-72,Milap Nagar,Midc,Dombivli,Thane,",421203,MH
0809,HMH0809,Aster Aadhar Hospital (Prerana Hospital Ltd),Maharashtra,Kolhapur,"R.S. No.628, 'B' Ward, Shastri Nagar, Near Kmt Workshop, Kolhapur, Maharashtra-416012Mangalwar Peth",416012,MH
0810,HMH0810,Athare Patil Memorial Hosp And Research Center Pvt Ltd,Maharashtra,Ahmednagar,"185,Savedi Road,Ahmednagar-414001Maharashtra",414001,MH
0811,HMH0811,Atole Accident Hospital,Maharashtra,Baramati,"Avdhoot Plaza,Bhigwan Road,",413102,MH
0812,HMH0812,Attharva Accident Hospital,Maharashtra,Pune,"Plot # 17,Vadgaon Road,Near Bank Of Maharashtra,Talegaon Dabhade",410507,MH
0813,HMH0813,Atul Hospital,Maharashtra,Mumbai,"26-A,Bharat Nagar, Grant Roadbharat Nagar",400008,MH
0814,HMH0814,Atul Lok Hospital,Maharashtra,Mumbai,"#139/2447,Tagore Nagar,Group-7,Vikhroli East",400083,MH
0815,HMH0815,Avadhoot Hospital & Iccu,Maharashtra,Mumbai,"Plot # 29,Sector-19,Thane",400708,MH
0816,HMH0816,Avanti Institute Of Cardiology Pvt. Ltd.,Maharashtra,Nagpur,"# 5, Abhyankar Road,Dhontolidhantoli, Nagpur-440012",440012,MH
0817,HMH0817,Badade Hospital,Maharashtra,Pune,"Agarwal Chambers,Mumbai Pune Highway",411044,MH
0818,HMH0818,Bagade Hospital For Women & Maternity Home,Maharashtra,Pune,"B.No. 7B F. No.3+4, Agarsen Nagar Dapodi, Pune-Mumbai Road, Opp .Atlas Copco Co Dapodi",411012,MH
0819,HMH0819,Bakhtar Hospital,Maharashtra,Amravati,"Raja Peth, Amravati-444601.",444601,MH
0820,HMH0820,Balaji Accident Hospital,Maharashtra,Malegaon,Malegaon Camp,423105,MH
0821,HMH0821,Balaji Healthcare (Rajpal Hospital),Maharashtra,Mumbai,"Plot #.13, Sector 10, Kopar-Khairane",400709,MH
0822,HMH0822,Balaji Hospital,Maharashtra,Mumbai,"Victoria Road, Cross Lane 3.",400027,MH
0823,HMH0823,Balaji Hospital,Maharashtra,Pune,"Bye Pass Chowk,Nagar Road",411014,MH
0824,HMH0824,Balaji Hospital,Maharashtra,Thane,"Golden Nest Phas 5 Mira Road,Bhayandar Thane.",401105,MH
0825,HMH0825,Balaji Maternity & Nursing Home,Maharashtra,Thane,"A 7/28,Hiramoti Complexshivaji Nagar, Wagle Estate",400604,MH
0826,HMH0826,Balaji Speciality Hospital,Maharashtra,Mumbai,"1St Floor, Jalaram Commercial Centre,Sakivihar Road,Sakinaka,",400072,MH
0827,HMH0827,Baldwa Hospital,Maharashtra,Mumbai,"Sumer Nagar, S.V. Road, Borivali West",400092,MH
0828,HMH0828,Baradkar Hospital & Maternity Home,Maharashtra,Mumbai,"14,A-3,Meera Queen,Opp Laxmi Cars,W.E.Highway,Kashimira,Thane",401107,MH
0829,HMH0829,Bardia Hospital,Maharashtra,Amravati,"Paratwada, Amravati,Opp. S.T. Stand.",444805,MH
0830,HMH0830,Bay View Clinic,Maharashtra,Mumbai,"3/3A, M. Parmanand Road,Mumbai-400004,",400004,MH
0831,HMH0831,Belle Vue Nursing Home,Maharashtra,Mumbai,"Sejal, 1St Floor, New Link Road Off Veera Desai Road Andheriroad, Versova, Andheri(W)",400058,MH
0832,HMH0832,Belokar Hospital,Maharashtra,Amravati,Vijay Colony Rukhmini Nagar,444606,MH
0833,HMH0833,Bembde Hospital,Maharashtra,Aurangabad,"14, Beed By Pass Road, Near Shahanoorwadi Rly Crossing, Satara Parisar, Aurangabad, Maharashtra",431005,MH
0834,HMH0834,Bendre Hospital And Maternity Home,Maharashtra,Ahmednagar,"7375,Deshmukhwadi,Sarjapura",414001,MH
0835,HMH0835,Benzer Nursing Home,Maharashtra,Mumbai,"2Nd Cross Road,Lokhandwala Complex,Andheri West",400053,MH
0836,HMH0836,Bethany Hospital,Maharashtra,Mumbai,"Next To Glaxo,Opp. Ma Niketan,",400610,MH
0837,HMH0837,Better Sight & Research Centre,Maharashtra,Mumbai,"Sector 7,B/29-004,Shantivagar,Mira Road East,Thane",401107,MH
0838,HMH0838,Bhagat Nursing Home,Maharashtra,Mumbai,Ganesh Nivas 2Nd Floorpai Nagar,400092,MH
0839,HMH0839,Bhagawati Netralaya,Maharashtra,Pune,Manik Chowk Chakan Tal Khed,410501,MH
0840,HMH0840,Bhagwati Healthcare Pvt Ltd,Maharashtra,Ulhasnagar,"Plot # 2, Rameshwadi, Kulgaon Badlapur Road, Badlapur West",421503,MH
0841,HMH0841,Bhagyojaya Hospital,Maharashtra,Baramati,Indapur Road,413102,MH
0842,HMH0842,Bhakti Hospital,Maharashtra,Pune,"Pune Nagar Road,Sanaswadi Chowk",412208,MH
0843,HMH0843,Bhaktivedanta Hospital,Maharashtra,Mumbai,"Sector-1, Srishti Complex, Mirthane",401107,MH
0844,HMH0844,Bhalerao Ent Hospital,Maharashtra,Pune,"Ganaraj Complex,2Nd Floor,# 3,Near Mahaslkant Chowk,Akurdi",411035,MH
0845,HMH0845,Bhandari Maternity & Nursing Home,Maharashtra,Pune,"5,Dhanlaxmi Society,Sinhagad Road",411051,MH
0846,HMH0846,Bharatiya Arogya Nidhi Sheth Kantilal C. Parikh General Hospital,Maharashtra,Mumbai,"N.S.Road.No.13, Jupds, Mumbai, Maharashtra",400049,MH
0847,HMH0847,Bhargava Nursing Home,Maharashtra,Mumbai,"Gopal Bhuvan, Tagore Road, Santacruz(W), Mumbai",400054,MH
0848,HMH0848,Bhartiya Maternity & Nursing Home,Maharashtra,Aurangabad,"3-12-65,Raja Bazar Jinsi Road",431001,MH
0849,HMH0849,Bhartiya Maternity & Nursing Home Pvt Ltd,Maharashtra,Aurangabad,"#27,Manjeet Nagar,Opp Akashwani Chowk Jalna Road",431001,MH
0850,HMH0850,Bhatia General Hospital,Maharashtra,Mumbai,"Tukaram Javji Road, Tardeo, Mumbai, Maharashtra",400007,MH
0851,HMH0851,Bhatiya Hospital,Maharashtra,Jalgaon,"'Dwarka'Deshpande Lane,Main Road,Chopda",425107,MH
0852,HMH0852,Bhatti Eye Clinic,Maharashtra,Mumbai,"# 22, Amar Mansion,Sion Trombay Road, Mumbai.",400088,MH
0853,HMH0853,Bhide Hospital,Maharashtra,Pune,"# 18, Laxmi Park, Navi Pethnavi Peth, Pune-411030.",411030,MH
0854,HMH0854,Bindu Nursing Home,Maharashtra,Pune,"Sudarshan Nager,Chinchwad",411033,MH
0855,HMH0855,Birajdar Hospital,Maharashtra,Solapur,"Ninali Vasti Road, Solapur,Maharashtra-413001",413001,MH
0856,HMH0856,Birmole Hospital,Maharashtra,Raigad,"No.118/1,Cuf Road,Cuf Nagar,Panvel,Opp Royal Cosmo Club",410206,MH
0857,HMH0857,Bobade Accident Hospital,Maharashtra,Baramati,"Bobade Accident Hospital, Baramati",413102,MH
0858,HMH0858,Bombay Hospital And Research Centre,Maharashtra,Mumbai,"#12,New Marine Lines,Mumbai",400020,MH
0859,HMH0859,Bora Ent Hospital,Maharashtra,Pune,"#2/4,Neeta Park Air Port Road,Yerwada",411006,MH
0860,HMH0860,Bora Hospital,Maharashtra,Pune,"#589, Ganesh Peth,Dhor Galli",411002,MH
0861,HMH0861,Breach Candy Hospital,Maharashtra,Mumbai,60-A Bhulabhai Desai Road,400026,MH
0862,HMH0862,Brijmohan Taori Memorial Hospital,Maharashtra,Nagpur,"Mo-1, Silver Palace, Dhantoli,Nagpur-440012",440012,MH
0863,HMH0863,Bses Mg Hospital,Maharashtra,Mumbai,"Sv Road, Andheri (W), Opp Andheri Rly Stn, Maharashtra",400058,MH
0864,HMH0864,Burute Hospital,Maharashtra,Bhosari,"Near Rupee Co-Op Bank,Opp Pune-Nashik Highway",411039,MH
0865,HMH0865,Burute Hospital,Maharashtra,Pune,"B,2-3,Laxmi Classic Poona Alandi Road, Mohanwadi Near Vishrantwadi,Yerwada",411006,MH
0866,HMH0866,Cardinal Gracious Memorial Hospital Trust,Maharashtra,Mumbai,"Sandor, Bangli Naka, Vasai West, Thane - 401201",401202,MH
0867,HMH0867,Central Avenue Critical Care Hospital & Iccu,Maharashtra,Nagpur,"Mahalaxmi Complex, Central Avenue Roaddarodkar Square, Central Avenu",440002,MH
0868,HMH0868,Chaitanya Hospital,Maharashtra,Pune,"Bhagirathi Nagar, Warje Malwadi.",411052,MH
0869,HMH0869,Chaitanya Hospital,Maharashtra,Pune,"Near Chinchwadgaon Police Chowky,Chapekar Chowk,Chinchwad,",411033,MH
0870,HMH0870,Chaitanya Hospital,Maharashtra,Pune,"A/P-Koregaon Bhima, Tal. Shirur, (Pune), Maharashtra",412216,MH
0871,HMH0871,Chaitanya Nursing Home,Maharashtra,Thane,"Poona Link Road, Kalyan East, Thane",421306,MH
0872,HMH0872,Chakrabarthy Medical Centre,Maharashtra,Ahmednagar,"Opp: Gurudwara Nagar, Near Aurangabad Road,Ahmednagar-414001",414001,MH
0873,HMH0873,Chandak Nursing Home,Maharashtra,Nagpur,"Supermarket Sita Building,Nagpur-440012.",440012,MH
0874,HMH0874,Chandralok Hospital,Maharashtra,Pune,"Chaitraban Apt.,Chandrika Society,Bibawewadi Road",411037,MH
0875,HMH0875,Chaphekar Iccu & Diabetes Hospital,Maharashtra,Mumbai,"Ashok Nagar, Ambadi Road(Opp) Bhaji Market, Vasai Road",401202,MH
0876,HMH0876,Charak Clinic Nursing Home,Maharashtra,Mumbai,"Laud Mansion,4Th Floor, 21,M Karvi Roadm.Karve Road,Opp.Charni Road",400004,MH
0877,HMH0877,Chhabda Hospital,Maharashtra,Aurangabad,"Plot No 5-6-19, New Osmanpura, Opp Sant Eknath Rang Mandir",431005,MH
0878,HMH0878,Chinmay Nursing Home,Maharashtra,Mumbai,"#103/104,Odyssey-A,Bhakti Park,Wadala East",400037,MH
